{
  "project": {
    "slug": "liniers",
    "workingTitle": {
      "es": "Las Invasiones",
      "en": "The Invasions"
    },
    "logline": {
      "es": "Buenos Aires, 1806–1807: dos invasiones británicas, una ciudad que se defiende sola y el nacimiento de una identidad.",
      "en": "Buenos Aires, 1806–1807: two British invasions, a city that defends itself, and the birth of an identity."
    },
    "languages": [
      "es",
      "en"
    ],
    "defaultLanguage": "es",
    "phase": "episodes"
  },
  "source": {
    "youtubeUrl": "https://youtu.be/WROVuJwqPtQ",
    "media": null,
    "transcripts": {
      "es": "source/transcript/es",
      "en": null
    },
    "segmentation": "source/segmentation.md"
  },
  "episodes": [
    {
      "id": "ep01",
      "title": {
        "es": "La ciudad humillada",
        "en": "The Humiliated City"
      },
      "status": "approved",
      "files": {
        "outline": "story/episodes/ep01/outline.md",
        "scriptEs": "story/episodes/ep01/script.es.md",
        "scriptEn": "story/episodes/ep01/script.en.md"
      },
      "continuityReports": [
        "story/continuity/ep01-r1.md",
        "story/continuity/ep01-r2.md"
      ]
    },
    {
      "id": "ep02",
      "title": {
        "es": "La Reconquista",
        "en": "The Reconquest"
      },
      "status": "outline",
      "files": {},
      "continuityReports": []
    },
    {
      "id": "ep03",
      "title": {
        "es": "El origen del origen",
        "en": "The Origin of the Origin"
      },
      "status": "outline",
      "files": {},
      "continuityReports": []
    }
  ],
  "characters": [
    {
      "id": "people",
      "name": "El pueblo de Buenos Aires (la multitud)",
      "historical": true,
      "status": "reference_generated",
      "sheet": "story/characters/people.md",
      "references": [
        "art/characters/people/crowd-frame.png",
        "art/characters/people/ensemble-sheet.png"
      ]
    },
    {
      "id": "liniers",
      "name": "Santiago de Liniers",
      "historical": true,
      "status": "reference_generated",
      "sheet": "story/characters/liniers.md",
      "references": [
        "art/characters/liniers/expressions.png",
        "art/characters/liniers/model-sheet.png",
        "art/characters/liniers/portrait.png"
      ]
    },
    {
      "id": "sobremonte",
      "name": "Rafael de Sobremonte",
      "historical": true,
      "status": "reference_generated",
      "sheet": "story/characters/sobremonte.md",
      "references": [
        "art/characters/sobremonte/expressions.png",
        "art/characters/sobremonte/model-sheet.png",
        "art/characters/sobremonte/portrait.png"
      ]
    },
    {
      "id": "beresford",
      "name": "William Carr Beresford",
      "historical": true,
      "status": "reference_generated",
      "sheet": "story/characters/beresford.md",
      "references": [
        "art/characters/beresford/expressions.png",
        "art/characters/beresford/model-sheet.png",
        "art/characters/beresford/portrait-v1.png",
        "art/characters/beresford/portrait-v2.png",
        "art/characters/beresford/portrait.png"
      ]
    },
    {
      "id": "marcela",
      "name": "Marcela (criolla de la fonda)",
      "historical": false,
      "status": "reference_generated",
      "sheet": "story/characters/marcela.md",
      "references": [
        "art/characters/marcela/expressions.png",
        "art/characters/marcela/model-sheet.png",
        "art/characters/marcela/portrait-alt.png",
        "art/characters/marcela/portrait.png"
      ]
    },
    {
      "id": "popham",
      "name": "Home Riggs Popham",
      "historical": true,
      "status": "sheet_drafted",
      "sheet": "story/characters/popham.md",
      "references": []
    },
    {
      "id": "alzaga",
      "name": "Martín de Álzaga",
      "historical": true,
      "status": "reference_generated",
      "sheet": "story/characters/alzaga.md",
      "references": [
        "art/characters/alzaga/expressions.png",
        "art/characters/alzaga/model-sheet.png",
        "art/characters/alzaga/portrait.png"
      ]
    },
    {
      "id": "whitelocke",
      "name": "John Whitelocke",
      "historical": true,
      "status": "reference_generated",
      "sheet": "story/characters/whitelocke.md",
      "references": [
        "art/characters/whitelocke/expressions.png",
        "art/characters/whitelocke/model-sheet.png",
        "art/characters/whitelocke/portrait-v1.png",
        "art/characters/whitelocke/portrait.png"
      ]
    },
    {
      "id": "manuela-pedraza",
      "name": "Manuela Pedraza",
      "historical": true,
      "status": "reference_generated",
      "sheet": "story/characters/manuela-pedraza.md",
      "references": [
        "art/characters/manuela-pedraza/expressions.png",
        "art/characters/manuela-pedraza/model-sheet.png",
        "art/characters/manuela-pedraza/portrait-alt.png",
        "art/characters/manuela-pedraza/portrait.png"
      ]
    },
    {
      "id": "gillespie",
      "name": "Alexander Gillespie",
      "historical": true,
      "status": "sheet_drafted",
      "sheet": "story/characters/gillespie.md",
      "references": []
    },
    {
      "id": "guemes",
      "name": "Martín Miguel de Güemes",
      "historical": true,
      "status": "sheet_drafted",
      "sheet": "story/characters/guemes.md",
      "references": []
    },
    {
      "id": "pueyrredon",
      "name": "Juan Martín de Pueyrredón",
      "historical": true,
      "status": "sheet_drafted",
      "sheet": "story/characters/pueyrredon.md",
      "references": []
    },
    {
      "id": "belgrano",
      "name": "Manuel Belgrano",
      "historical": true,
      "status": "sheet_drafted",
      "sheet": "story/characters/belgrano.md",
      "references": []
    },
    {
      "id": "saavedra",
      "name": "Cornelio Saavedra",
      "historical": true,
      "status": "sheet_drafted",
      "sheet": "story/characters/saavedra.md",
      "references": []
    }
  ],
  "decisions": {
    "pending": [],
    "resolved": [
      {
        "id": "dec-001",
        "topic": "estetica-visual",
        "question": {
          "es": "¿Estética visual de la obra? Ej.: ilustración estilo Liniers (línea suelta, acuarela), grabado/aguafuerte de época, pintura histórica realista, o cinematografía live-action estilizada.",
          "en": "Visual aesthetic? E.g., Liniers-style illustration (loose line, watercolor), period etching/engraving, realistic historical painting, or stylized live-action cinematography."
        },
        "options": [
          "ilustracion-acuarela",
          "grabado-epoca",
          "pintura-historica",
          "live-action-estilizado"
        ],
        "raisedBy": "creative-director",
        "status": "answered",
        "answer": "live-action-estilizado",
        "answeredAt": "2026-08-14T22:24:15Z"
      },
      {
        "id": "dec-002",
        "topic": "formato",
        "question": {
          "es": "¿Cuántos episodios y de qué duración objetivo? (La segmentación de la transcripción propondrá cortes, pero el formato es decisión de dirección.)",
          "en": "How many episodes and target duration? (Transcript segmentation will propose cuts, but format is a directorial decision.)"
        },
        "raisedBy": "creative-director",
        "status": "answered",
        "answer": "B: 3 episodios (La ciudad humillada / La Reconquista / El origen del origen)",
        "answeredAt": "2026-08-14T22:24:15Z"
      },
      {
        "id": "dec-003",
        "topic": "narracion",
        "question": {
          "es": "¿La voz del video fuente es la narración de la película (voz en off) o se re-graba/sintetiza? ¿Se dobla al inglés o subtitula?",
          "en": "Is the source video's voice the film's narration (voice-over), or re-recorded/synthesized? Dubbed or subtitled in English?"
        },
        "raisedBy": "creative-director",
        "status": "answered",
        "answer": "ficción dialogada estilo producción de Hollywood: los personajes históricos (Liniers, Beresford...) hablan; sin narrador en off ni dispositivo-marco; Julia y Pedro solo informan a los agentes",
        "answeredAt": "2026-08-14T22:24:15Z"
      },
      {
        "id": "dec-004",
        "topic": "aspect-ratio",
        "question": {
          "es": "¿Relación de aspecto y cadencia? Ej.: 2.39:1 cine épico, 16:9 estándar, 4:3 de época.",
          "en": "Aspect ratio and frame cadence? E.g., 2.39:1 epic, 16:9 standard, 4:3 period feel."
        },
        "raisedBy": "creative-director",
        "status": "answered",
        "answer": "16:9",
        "answeredAt": "2026-08-14T22:24:15Z"
      },
      {
        "id": "dec-005",
        "topic": "idioma-dialogos",
        "question": {
          "es": "¿Los personajes británicos hablan inglés (película bilingüe con subtítulos) o todo el elenco habla español? Impacta guion, casting de voces y versiones por idioma.",
          "en": "Do British characters speak English (bilingual film with subtitles) or does the whole cast speak Spanish? Impacts scripts, voice casting, and language versions."
        },
        "options": [
          "bilingue-subtitulado",
          "todo-espanol",
          "doble-version"
        ],
        "raisedBy": "creative-director",
        "status": "answered",
        "answer": "bilingüe subtitulado: los personajes británicos hablan inglés; subtítulos en el idioma de cada versión",
        "answeredAt": "2026-08-15T02:46:14Z"
      }
    ]
  },
  "renders": {
    "queue": [],
    "completed": []
  },
  "updatedAt": "2026-08-16T22:03:30Z"
}
